{"type":"config","name":"route-heuristic-coverage","metric_name":"fallback_rate","metric_unit":"%","direction":"lower_is_better","benchmark_command":"bash interlab-route-heuristics.sh","working_directory":"/home/mk/projects/Demarch","max_experiments":50,"max_crashes":3,"max_no_improvement":10,"timestamp":"2026-03-14T03:44:05Z"}
{"type":"result","decision":"keep","description":"Baseline: 7 heuristics from route.md Step 4a. Coverage: 16% (8/50). Fallback rate: 84%.","metric_value":84,"duration_ms":114284,"exit_code":0,"secondary_metrics":{"fallback_count":42,"heuristic_coverage":16,"heuristic_hits":8,"total_beads":50},"timestamp":"2026-03-14T03:46:07Z"}
{"type":"result","decision":"crash","description":"Unbound variable: complexity was empty for some beads, causing -le comparison to fail. Added numeric guards.","duration_ms":30875,"exit_code":1,"timestamp":"2026-03-14T03:47:24Z"}
{"type":"result","decision":"keep","description":"Added 9 new heuristics (8-16): bug→work, task+C≤3→work, decision→sprint, epic-no-children→sprint, research-keywords→sprint, C2→work, C4→sprint, brainstorm-no-plan→sprint, feature+C3→sprint. Plus numeric guards for empty complexity/child_count. Coverage: 16% → 100%. Fallback: 84% → 0%.","duration_ms":112824,"exit_code":0,"secondary_metrics":{"fallback_count":0,"heuristic_coverage":100,"heuristic_hits":50,"total_beads":50},"timestamp":"2026-03-14T03:49:33Z"}
{"type":"config","name":"route-heuristic-coverage","metric_name":"fallback_rate","metric_unit":"%","direction":"lower_is_better","benchmark_command":"bash interlab-route-heuristics.sh","working_directory":"/home/mk/projects/Demarch","max_experiments":50,"max_crashes":3,"max_no_improvement":10,"timestamp":"2026-03-17T06:15:26Z"}
{"type":"result","decision":"discard","description":"Baseline measurement only — no code changes. Result: fallback_rate=0%, heuristic_coverage=100% across 50 closed beads. All beads routed by existing 16 heuristics. Campaign target already at floor; no optimization possible on current dataset.","duration_ms":19194,"exit_code":0,"secondary_metrics":{"fallback_count":0,"heuristic_coverage":100,"heuristic_hits":50,"total_beads":50},"timestamp":"2026-03-17T06:16:16Z"}
{"type":"campaign_closed","name":"route-heuristic-coverage","reason":"target_achieved","summary":"Reduced fallback_rate from 84% to 0% (100% heuristic coverage). 16 rules cover all 50 closed beads. 3 experiments total (1 crash, 2 kept, 1 confirmation discard).","timestamp":"2026-03-17T06:20:21Z"}
